### ISSUE TITLE
 "Transplant a module" return error 500 after an Anvanto theme installation

### ISSUE THREAD

**Issue by gdebusigne** [PrestaShop/PrestaShop#11143]
**Describe the bug**
Hello, 

We setup a Prestashop from official docker image and everything works well. 

If we install a theme from Avanto (lemanoosh or another), and we try to use the "Transplant a module" functionality  we got an error 500 (front and back goes offline).

On server side when we click on "transplant a module" and we do a TCPDUMP in the same time, the packet capture shows that the website keeps trying to communicate with 'api.addons.prestashop.com' like an infinite loop querying..  this for about 10 minutes, the the site goes online again.

######### Capture
14:58:03.692244 IP a6386226138c.39464 > 10.100.100.158.53: 35947+ AAAA? api.addons.prestashop.com. (43)
14:58:03.692344 IP a6386226138c.39111 > 10.100.100.158.53: 32237+ A? api.addons.prestashop.com. (43)
14:58:03.692614 IP 10.100.100.158.53 > a6386226138c.39464: 35947 0/1/0 (109)
14:58:03.692623 IP 10.100.100.158.53 > a6386226138c.39111: 32237 1/3/0 A 91.240.109.18 (147)
14:58:03.692979 IP a6386226138c.42902 > 91.240.109.18.443: Flags [S], seq 47880165, win 29200, options [mss 1460,sackOK,TS val 3676650887 ecr 0,nop,wscale 7], length 0
14:58:03.727766 IP 91.240.109.18.443 > a6386226138c.42900: Flags [R], seq 651664039, win 0, length 0
14:58:03.727773 IP 91.240.109.18.443 > a6386226138c.42900: Flags [R], seq 651664039, win 0, length 0
14:58:03.729243 IP 91.240.109.18.443 > a6386226138c.42902: Flags [S.], seq 361563215, ack 47880166, win 28960, options [mss 1460,sackOK,TS val 2050975988 ecr 3676650887,nop,wscale 7], length 0
14:58:03.729294 IP a6386226138c.42902 > 91.240.109.18.443: Flags [.], ack 1, win 229, options [nop,nop,TS val 3676650896 ecr 2050975988], length 0
14:58:03.729558 IP a6386226138c.42902 > 91.240.109.18.443: Flags [P.], seq 1:518, ack 1, win 229, options [nop,nop,TS val 3676650896 ecr 2050975988], length 517
14:58:03.805441 IP 91.240.109.18.443 > a6386226138c.42902: Flags [.], seq 1:1449, ack 518, win 235, options [nop,nop,TS val 2050976007 ecr 3676650896], length 1448
14:58:03.805526 IP a6386226138c.42902 > 91.240.109.18.443: Flags [.], ack 1449, win 251, options [nop,nop,TS val 3676650915 ecr 2050976007], length 0
14:58:03.805597 IP 91.240.109.18.443 > a6386226138c.42902: Flags [.], seq 1449:4345, ack 518, win 235, options [nop,nop,TS val 2050976007 ecr 3676650896], length 2896
14:58:03.805626 IP a6386226138c.42902 > 91.240.109.18.443: Flags [.], ack 4345, win 296, options [nop,nop,TS val 3676650915 ecr 2050976007], length 0
###############

We ask the Anvanto Team, showing that's the problem is coming only after the setup of their theme but there answer is clear : _"The idea is that Back Office and its functional (Transplan the Module) is Prestashop Functional and we kindly ask you to consult Addons Support Team on this issue. The theme has the functional based on Prestashop and there is nothing extra in it that can block the Back Office functional."_

A work arround is to patch "AdminModulesPositionsController.php", in the controllers part that you comment with a '@todo do something better with controllers' 
$all_modules_controllers = Dispatcher::getModuleControllers($type);
by
$all_modules_controllers = Dispatcher::getControllers($type);

Is this problem a part of Prestashop  as saying Avanto or is this an issue with the Avanto developers?

**To Reproduce**

- > Setup a new Prestashop   1.7.4.2 from docker hub, install an Avanto theme, activate it.

Imporve -> Design -> Positions	

Transplant a module
error 500

A tcpdump in the same time of this action shows that the site keep trying to communicate with Prestashop.

**Additionnal information**
PrestaShop version: 1.7.4.2 (DOCKER Prestashop/Prestashop: 1.7-7.2-apache)
PHP version: 7.2

- Out of the box, set it up in English, removed the install folder and rename the admin one.

**Comment by khouloudbelguith** [comment]
Hi @gdebusigne,

We need to retrieve the PHP error log in order to find out what's wrong.
Don't you know how to get this information? Please read the following article:
http://build.prestashop.com/howtos/misc/how-to-create-bug-report/

Thanks!

**Comment by khouloudbelguith** [comment]
Hi @gdebusigne,

Since we had no news from you for more than 30 days, I'll close this ticket. Feel free to open another one if you can give specific details.
Thanks!
